[
  {
    "id": "sydney_cbd",
    "name": "Sydney CBD",
    "zone_color": "green",
    "lat": -33.8688,
    "lon": 151.2093,
    "growth_mu": 0.06,
    "growth_sigma": 0.08,
    "default_mu": 0.005,
    "default_sigma": 0.01,
    "liquidity_score": 0.95,
    "risk_weight": 0.4
  },
  {
    "id": "north_sydney",
    "name": "North Sydney",
    "zone_color": "green",
    "lat": -33.8390,
    "lon": 151.2070,
    "growth_mu": 0.055,
    "growth_sigma": 0.075,
    "default_mu": 0.006,
    "default_sigma": 0.012,
    "liquidity_score": 0.93,
    "risk_weight": 0.4
  },
  {
    "id": "bondi",
    "name": "Bondi",
    "zone_color": "green",
    "lat": -33.8908,
    "lon": 151.2743,
    "growth_mu": 0.058,
    "growth_sigma": 0.08,
    "default_mu": 0.007,
    "default_sigma": 0.013,
    "liquidity_score": 0.9,
    "risk_weight": 0.45
  },
  {
    "id": "chatswood",
    "name": "Chatswood",
    "zone_color": "green",
    "lat": -33.7960,
    "lon": 151.1820,
    "growth_mu": 0.053,
    "growth_sigma": 0.07,
    "default_mu": 0.007,
    "default_sigma": 0.013,
    "liquidity_score": 0.88,
    "risk_weight": 0.45
  },
  {
    "id": "cronulla",
    "name": "Cronulla",
    "zone_color": "green",
    "lat": -34.0526,
    "lon": 151.1527,
    "growth_mu": 0.05,
    "growth_sigma": 0.07,
    "default_mu": 0.008,
    "default_sigma": 0.014,
    "liquidity_score": 0.85,
    "risk_weight": 0.5
  },
  {
    "id": "newtown",
    "name": "Newtown",
    "zone_color": "green",
    "lat": -33.8980,
    "lon": 151.1740,
    "growth_mu": 0.052,
    "growth_sigma": 0.075,
    "default_mu": 0.008,
    "default_sigma": 0.014,
    "liquidity_score": 0.86,
    "risk_weight": 0.5
  },
  {
    "id": "parramatta",
    "name": "Parramatta",
    "zone_color": "orange",
    "lat": -33.8130,
    "lon": 151.0033,
    "growth_mu": 0.045,
    "growth_sigma": 0.09,
    "default_mu": 0.012,
    "default_sigma": 0.02,
    "liquidity_score": 0.75,
    "risk_weight": 0.8
  },
  {
    "id": "liverpool",
    "name": "Liverpool",
    "zone_color": "orange",
    "lat": -33.9215,
    "lon": 150.9245,
    "growth_mu": 0.042,
    "growth_sigma": 0.09,
    "default_mu": 0.013,
    "default_sigma": 0.021,
    "liquidity_score": 0.72,
    "risk_weight": 0.85
  },
  {
    "id": "blacktown",
    "name": "Blacktown",
    "zone_color": "red",
    "lat": -33.7668,
    "lon": 150.9083,
    "growth_mu": 0.038,
    "growth_sigma": 0.1,
    "default_mu": 0.018,
    "default_sigma": 0.03,
    "liquidity_score": 0.55,
    "risk_weight": 1.3
  },
  {
    "id": "penrith",
    "name": "Penrith",
    "zone_color": "red",
    "lat": -33.7510,
    "lon": 150.6940,
    "growth_mu": 0.035,
    "growth_sigma": 0.11,
    "default_mu": 0.02,
    "default_sigma": 0.032,
    "liquidity_score": 0.5,
    "risk_weight": 1.35
  }
] 